{
  "schema_version": 1,
  "name": "FlashKDA",
  "upstream_url": "https://github.com/MoonshotAI/FlashKDA",
  "fork_url": null,
  "fork_default_branch": "master",
  "priority": 4.918,
  "ext_type": "unknown",
  "adopted_at": "2026-05-30T00:46:51Z",
  "updated_at": "2026-05-30T00:46:51Z",
  "head_sha": null,
  "platforms": {
    "linux-gfx90a": {
      "state": "unclaimed",
      "blocked": false,
      "blocked_reason": null,
      "validated_sha": null,
      "started_at": null,
      "completed_at": null,
      "updated_at": "2026-05-30T00:46:51Z",
      "stats": {
        "tokens_total": 0,
        "tokens_approx": true,
        "wall_seconds": {
          "thinking": 0,
          "compile": 0,
          "test": 0,
          "misc": 0
        },
        "session_count": 0,
        "first_session_at": null,
        "last_session_at": null
      }
    },
    "linux-gfx1100": {
      "state": "blocked-needs-gfx90a",
      "blocked": false,
      "blocked_reason": null,
      "validated_sha": null,
      "started_at": null,
      "completed_at": null,
      "updated_at": "2026-05-30T00:46:51Z",
      "stats": {
        "tokens_total": 0,
        "tokens_approx": true,
        "wall_seconds": {
          "thinking": 0,
          "compile": 0,
          "test": 0,
          "misc": 0
        },
        "session_count": 0,
        "first_session_at": null,
        "last_session_at": null
      }
    },
    "windows-gfx1151": {
      "state": "blocked-needs-gfx90a",
      "blocked": false,
      "blocked_reason": null,
      "validated_sha": null,
      "started_at": null,
      "completed_at": null,
      "updated_at": "2026-05-30T00:46:51Z",
      "stats": {
        "tokens_total": 0,
        "tokens_approx": true,
        "wall_seconds": {
          "thinking": 0,
          "compile": 0,
          "test": 0,
          "misc": 0
        },
        "session_count": 0,
        "first_session_at": null,
        "last_session_at": null
      }
    }
  }
}
